Название,Категория,UPC (Айди),Описание,Рейтинг,Тип продукта,Цена без налога,Цена с налогом:,Налог,Наличие,Кол-во отзывов,Картинка,Ссылка
Benjamin Franklin: An American Life,Biography,5b546a46a86a9d8c,"Benjamin Franklin is the Founding Father who winks at us. An ambitious urban entrepreneur who rose up the social ladder, from leather-aproned shopkeeper to dining with kings, he seems made of flesh rather than of marble. In bestselling author Walter Isaacson's vivid and witty full-scale biography, we discover why Franklin seems to turn to us from history's stage with eyes Benjamin Franklin is the Founding Father who winks at us. An ambitious urban entrepreneur who rose up the social ladder, from leather-aproned shopkeeper to dining with kings, he seems made of flesh rather than of marble. In bestselling author Walter Isaacson's vivid and witty full-scale biography, we discover why Franklin seems to turn to us from history's stage with eyes that twinkle from behind his new-fangled spectacles. By bringing Franklin to life, Isaacson shows how he helped to define both his own time and ours. He was, during his 84-year life, America's best scientist, inventor, diplomat, writer, and business strategist, and he was also one of its most practical -- though not most profound -- political thinkers. He proved by flying a kite that lightning was electricity, and he invented a rod to tame it. He sought practical ways to make stoves less smoky and commonwealths less corrupt. He organized neighborhood constabularies and international alliances, local lending libraries and national legislatures. He combined two types of lenses to create bifocals and two concepts of representation to foster the nation's federal compromise. He was the only man who shaped all the founding documents of America: the Albany Plan of Union, the Declaration of Independence, the treaty of alliance with France, the peace treaty with England, and the Constitution. And he helped invent America's unique style of homespun humor, democratic values, and philosophical pragmatism. But the most interesting thing that Franklin invented, and continually reinvented, was himself. America's first great publicist, he was, in his life and in his writings, consciously trying to create a new American archetype. In the process, he carefully crafted his own persona, portrayed it in public, and polished it for posterity. Through it all, he trusted the hearts and minds of his fellow ""leather-aprons"" more than he did those of any inbred elite. He saw middle-class values as a source of social strength, not as something to be derided. His guiding principle was a ""dislike of everything that tended to debase the spirit of the common people."" Few of his fellow founders felt this comfort with democracy so fully, and none so intuitively. In this colorful and intimate narrative, Isaacson provides the full sweep of Franklin's amazing life, from his days as a runaway printer to his triumphs as a statesman, scientist, and Founding Father. He chronicles Franklin's tumultuous relationship with his illegitimate son and grandson, his practical marriage, and his flirtations with the ladies of Paris. He also shows how Franklin helped to create the American character and why he has a particular resonance in the twenty-first century. ...more",3,Books,£48.19,£48.19,£0.00,In stock (7 available),0,https://books.toscrape.com/media/cache/c2/7e/c27efce6a2321c10b0d34035308ace37.jpg,https://books.toscrape.com/catalogue/benjamin-franklin-an-american-life_460/index.html
"At The Existentialist Café: Freedom, Being, and apricot cocktails with: Jean-Paul Sartre, Simone de Beauvoir, Albert Camus, Martin Heidegger, Edmund Husserl, Karl Jaspers, Maurice Merleau-Ponty and others",Philosophy,6b52904b2ab91bf6,"Paris, near the turn of 1933. Three young friends meet over apricot cocktails at the Bec-de-Gaz bar on the rue Montparnasse. They are Jean-Paul Sartre, Simone de Beauvoir and their friend Raymond Aron, who opens their eyes to a radical new way of thinking. Pointing to his drink, he says, 'You can make philosophy out of this cocktail!'From this moment of inspiration, Sartre Paris, near the turn of 1933. Three young friends meet over apricot cocktails at the Bec-de-Gaz bar on the rue Montparnasse. They are Jean-Paul Sartre, Simone de Beauvoir and their friend Raymond Aron, who opens their eyes to a radical new way of thinking. Pointing to his drink, he says, 'You can make philosophy out of this cocktail!'From this moment of inspiration, Sartre will create his own extraordinary philosophy of real, experienced life – of love and desire, of freedom and being, of cafés and waiters, of friendships and revolutionary fervour. It is a philosophy that will enthral Paris and sweep through the world, leaving its mark on post-war liberation movements, from the student uprisings of 1968 to civil rights pioneers.At the Existentialist Café tells the story of modern existentialism as one of passionate encounters between people, minds and ideas. From the ‘king and queen of existentialism' – Sartre and de Beauvoir – to their wider circle of friends and adversaries including Albert Camus, Martin Heidegger, Maurice Merleau-Ponty and Iris Murdoch, this book is an enjoyable and original journey through a captivating intellectual movement. Weaving biography and thought, Sarah Bakewell takes us to the heart of a philosophy about life that also changed lives, and that tackled the biggest questions of all: what we are and how we are to live. ...more",5,Books,£29.93,£29.93,£0.00,In stock (7 available),0,https://books.toscrape.com/media/cache/ce/da/ceda6d577d0609261f997bd99872013b.jpg,https://books.toscrape.com/catalogue/at-the-existentialist-cafe-freedom-being-and-apricot-cocktails-with-jean-paul-sartre-simone-de-beauvoir-albert-camus-martin-heidegger-edmund-husserl-karl-jaspers-maurice-merleau-ponty-and-others_459/index.html
A Summer In Europe,Travel,cc1936a9f4e93477,"On her thirtieth birthday, Gwendolyn Reese receives an unexpected present from her widowed Aunt Bea: a grand tour of Europe in the company of Bea's Sudoku and Mahjongg Club. The prospect isn't entirely appealing. But when the gift she is expecting--an engagement ring from her boyfriend--doesn't materialize, Gwen decides to go. At first, Gwen approaches the trip as if it's On her thirtieth birthday, Gwendolyn Reese receives an unexpected present from her widowed Aunt Bea: a grand tour of Europe in the company of Bea's Sudoku and Mahjongg Club. The prospect isn't entirely appealing. But when the gift she is expecting--an engagement ring from her boyfriend--doesn't materialize, Gwen decides to go. At first, Gwen approaches the trip as if it's the math homework she assigns her students, diligently checking monuments off her must-see list. But amid the bougainvillea and stunning vistas of southern Italy, something changes. Gwen begins to live in the moment--skipping down stone staircases in Capri, running her fingers over a glacier in view of the Matterhorn, racing through the Louvre, and taste-testing pastries at a Marseilles cafe. Reveling in every new experience--especially her attraction to a charismatic British physics professor--Gwen discovers that the ancient wonders around her are nothing compared to the renaissance unfolding within. . . ""A thinking woman's love story, it swept me away to breathtaking places with a cast of endearing characters I won't soon forget. Bravissima!"" Susan McBride, author of ""Little Black Dress"" Praise for Marilyn Brant's According to Jane ""A warm, witty and charmingly original story."" --Susan Wiggs, ""New York Times "" bestselling author ""Brant infuses her sweetly romantic and delightfully clever tale with just the right dash of Austen-esque wit."" ""Chicago Tribune"" ""An engaging read for all who have been through the long, dark, dating wars, and still believe there's sunshine, and a Mr. Darcy, at the end of the tunnel."" --Cathy Lamb, author of ""Such a Pretty Face"""" ...more",2,Books,£44.34,£44.34,£0.00,In stock (7 available),0,https://books.toscrape.com/media/cache/6c/e3/6ce3003931701c7a3fd5354917538ea9.jpg,https://books.toscrape.com/catalogue/a-summer-in-europe_458/index.html
A Short History of Nearly Everything,History,6c7fa6844380f50a,"In Bryson's biggest book, he confronts his greatest challenge: to understand—and, if possible, answer—the oldest, biggest questions we have posed about the universe and ourselves. Taking as territory everything from the Big Bang to the rise of civilization, Bryson seeks to understand how we got from there being nothing at all to there being us. To that end, he has attached In Bryson's biggest book, he confronts his greatest challenge: to understand—and, if possible, answer—the oldest, biggest questions we have posed about the universe and ourselves. Taking as territory everything from the Big Bang to the rise of civilization, Bryson seeks to understand how we got from there being nothing at all to there being us. To that end, he has attached himself to a host of the world’s most advanced (and often obsessed) archaeologists, anthropologists, and mathematicians, travelling to their offices, laboratories, and field camps. He has read (or tried to read) their books, pestered them with questions, apprenticed himself to their powerful minds. A Short History of Nearly Everything is the record of this quest, and it is a sometimes profound, sometimes funny, and always supremely clear and entertaining adventure in the realms of human knowledge, as only Bill Bryson can render it. Science has never been more involving or entertaining. ...more",5,Books,£52.40,£52.40,£0.00,In stock (7 available),0,https://books.toscrape.com/media/cache/17/aa/17aa3d17bae02fa1d0e2a831c0c0e58b.jpg,https://books.toscrape.com/catalogue/a-short-history-of-nearly-everything_457/index.html
A Gathering of Shadows (Shades of Magic #2),Fantasy,d1378a0ad06ff979,"It has been four months since a mysterious obsidian stone fell into Kell's possession. Four months since his path crossed with Delilah Bard. Four months since Prince Rhy was wounded, and since the nefarious Dane twins of White London fell, and four months since the stone was cast with Holland's dying body through the rift – back into Black London.Now, restless after having It has been four months since a mysterious obsidian stone fell into Kell's possession. Four months since his path crossed with Delilah Bard. Four months since Prince Rhy was wounded, and since the nefarious Dane twins of White London fell, and four months since the stone was cast with Holland's dying body through the rift – back into Black London.Now, restless after having given up his smuggling habit, Kell is visited by dreams of ominous magical events, waking only to think of Lila, who disappeared from the docks as she always meant to do. As Red London finalizes preparations for the Element Games – an extravagant international competition of magic meant to entertain and keep healthy the ties between neighboring countries – a certain pirate ship draws closer, carrying old friends back into port.And while Red London is caught up in the pageantry and thrills of the Games, another London is coming back to life. After all, a shadow that was gone in the night will reappear in the morning. But the balance of magic is ever perilous, and for one city to flourish, another London must fall. ...more",4,Books,£44.81,£44.81,£0.00,In stock (7 available),0,https://books.toscrape.com/media/cache/c3/1a/c31af6fddfa452d9d746a599f35dcc01.jpg,https://books.toscrape.com/catalogue/a-gathering-of-shadows-shades-of-magic-2_456/index.html
The Sound Of Love,Default,5ba3d703d1ae0c1d,"Born and raised on her family farm in rural East Tennessee, Danielle Adams always dreamed of moving to Nashville—known in her family as the “big city”. She had the voice of an angel and her skills on the piano put her on par with some of the best pianists in the world. On her twenty-first birthday, Danielle’s parents bought her a one-way ticket to “the big city” and gave h Born and raised on her family farm in rural East Tennessee, Danielle Adams always dreamed of moving to Nashville—known in her family as the “big city”. She had the voice of an angel and her skills on the piano put her on par with some of the best pianists in the world. On her twenty-first birthday, Danielle’s parents bought her a one-way ticket to “the big city” and gave her enough money to live for a year. Her parents—along with everyone at their church and all through the town—knew of her talents and felt it was time she shared her GOD-given gifts with the world.Danielle’s life in Nashville starts off rocky, but eventually she finds her way. Before long, a music producer notices her talents and signs her to a record deal. After performing in a few shows, she instantly becomes the new darling of Nashville. One day while performing, Danielle notices that her hearing seems to be going in and out. After this happens a couple more times, Danielle decides it’s time for her to go see a doctor. To her shock, she learns that she has a rare genetic disorder that will cause her to eventually become deaf. Her doctor gives her a referral to someone who can teach her sign language and other useful devices that will make life easier once her hearing is fully gone. Danielle—devastated to say the least—falls into a deep depression and begins questioning GOD’s plan for her life.Eventually, Danielle goes to meet with the doctor’s referral, Walker Davenport; who turns out to be an exceptionally handsome and kind man—who also happens to be a musician himself. He helps her prepare for life as a deaf person—starting with making her a hearing “bucket list”. Walker even shows her ways she can still have music in her life even if she is unable to hear. Over time, Daniele and Walker become close and eventually fall in love. Their young love blossoms, and marriage seems to be right on the horizon. That is, until the day that they had been planning for finally arrives—when Danielle’s hearing is completely gone. Unable to handle her new reality, Danielle rebuffs Walker, and shuts out the rest of the world—even her close nit family. Walker then finds himself trying to prove to her that the sound of love can still be heard even when your world is silent. ...more",5,Books,£57.84,£57.84,£0.00,In stock (6 available),0,https://books.toscrape.com/media/cache/90/df/90dfdcadfcff9cd39f6f933ac11c9241.jpg,https://books.toscrape.com/catalogue/the-sound-of-love_455/index.html
The Rise and Fall of the Third Reich: A History of Nazi Germany,History,774fa432bd7d9c47,"Hitler boasted that The Third Reich would last a thousand years. It lasted only 12. But those 12 years contained some of the most catastrophic events Western civilization has ever known. In The Rise and Fall of the Third Reich, William L. Shirer gave us the definitive book on Hitler's German Empire. Based on his personal experiences as a war correspondent as well as the vo Hitler boasted that The Third Reich would last a thousand years. It lasted only 12. But those 12 years contained some of the most catastrophic events Western civilization has ever known. In The Rise and Fall of the Third Reich, William L. Shirer gave us the definitive book on Hitler's German Empire. Based on his personal experiences as a war correspondent as well as the voluminous documents that came out of Germany after the war, this thrilling account of Hitler's reign is widely acclaimed to be one of the greatest historical works of our time. Now available as an exclusive anniversary edition, this volume is as compelling as ever. Everything about the period is explained to the fullest, beginning with Hitler's rise to power, the Nazification of Germany and the march to war. The accounts of how the United States got involved and how Hitler used Mussolini and Japan are astonishing, and the coverage of the war-from Germany's early successes to her eventual defeat-is must reading ...more",2,Books,£39.67,£39.67,£0.00,In stock (6 available),0,https://books.toscrape.com/media/cache/10/f6/10f6ebfa89b070ba39ad7c4c872c96ea.jpg,https://books.toscrape.com/catalogue/the-rise-and-fall-of-the-third-reich-a-history-of-nazi-germany_454/index.html
The Perks of Being a Wallflower,Default,fd364afd082f5446,"Charlie is a freshman.And while he's not the biggest geek in the school, he is by no means popular. Shy, introspective, intelligent beyond his years yet socially awkward, he is a wallflower, caught between trying to live his life and trying to run from it.Charlie is attempting to navigate his way through uncharted territory: the world of first dates and mix tapes, family d Charlie is a freshman.And while he's not the biggest geek in the school, he is by no means popular. Shy, introspective, intelligent beyond his years yet socially awkward, he is a wallflower, caught between trying to live his life and trying to run from it.Charlie is attempting to navigate his way through uncharted territory: the world of first dates and mix tapes, family dramas and new friends; the world of sex, drugs, and The Rocky Horror Picture Show, when all one requires is that perfect song on that perfect drive to feel infinite. But he can't stay on the sideline forever. Standing on the fringes of life offers a unique perspective. But there comes a time to see what it looks like from the dance floor.The Perks of Being a Wallflower is a deeply affecting coming-of-age story that will spirit you back to those wild and poignant roller-coaster days known as growing up. ...more",3,Books,£55.02,£55.02,£0.00,In stock (6 available),0,https://books.toscrape.com/media/cache/28/21/28219255776fb162c82ebac3cdddcf90.jpg,https://books.toscrape.com/catalogue/the-perks-of-being-a-wallflower_453/index.html
The Mysterious Affair at Styles (Hercule Poirot #1),Mystery,2da5edf8b5776c9a,"Poirot, a Belgian refugee of the Great War, is settling in England near the home of Emily Inglethorp, who helped him to his new life. His friend Hastings arrives as a guest at her home. When the woman is killed, Poirot uses his detective skills to solve the mystery.",4,Books,£24.80,£24.80,£0.00,In stock (6 available),0,https://books.toscrape.com/media/cache/6b/61/6b61d393f0731f6c52182ba3cf41e245.jpg,https://books.toscrape.com/catalogue/the-mysterious-affair-at-styles-hercule-poirot-1_452/index.html
The Man Who Mistook His Wife for a Hat and Other Clinical Tales,Nonfiction,60376aa71be66083,"In his most extraordinary book, ""one of the great clinical writers of the twentieth century"" (The New York Times) recounts the case histories of patients lost in the bizarre, apparently inescapable world of neurological disorders. Oliver Sacks's The Man Who Mistook His Wife for a Hat tells the stories of individuals afflicted with fantastic perceptual and intellectual aber In his most extraordinary book, ""one of the great clinical writers of the twentieth century"" (The New York Times) recounts the case histories of patients lost in the bizarre, apparently inescapable world of neurological disorders. Oliver Sacks's The Man Who Mistook His Wife for a Hat tells the stories of individuals afflicted with fantastic perceptual and intellectual aberrations: patients who have lost their memories and with them the greater part of their pasts; who are no longer able to recognize people and common objects; who are stricken with violent tics and grimaces or who shout involuntary obscenities; whose limbs have become alien; who have been dismissed as retarded yet are gifted with uncanny artistic or mathematical talents.If inconceivably strange, these brilliant tales remain, in Dr. Sacks's splendid and sympathetic telling, deeply human. They are studies of life struggling against incredible adversity, and they enable us to enter the world of the neurologically impaired, to imagine with our hearts what it must be to live and feel as they do. A great healer, Sacks never loses sight of medicine's ultimate responsibility: ""the suffering, afflicted, fighting human subject."" ...more",4,Books,£59.45,£59.45,£0.00,In stock (6 available),0,https://books.toscrape.com/media/cache/d7/58/d758851b2790471b1de776f49a997157.jpg,https://books.toscrape.com/catalogue/the-man-who-mistook-his-wife-for-a-hat-and-other-clinical-tales_451/index.html
The Makings of a Fatherless Child,Default,2efa5a839e62b1bd,"Chandler Alexander's The Makings of a Fatherless Child is a dark and riveting tale of a young boy, Amel River, growing of age in the Mississippi Delta all while trying to survive a broken home, poverty, fatherlessness, and a voice in his head that won't go away. With the wisdom of a drunken stranger King Lee, the unspoken love of his best friend Sea'Sea, and the innocent e Chandler Alexander's The Makings of a Fatherless Child is a dark and riveting tale of a young boy, Amel River, growing of age in the Mississippi Delta all while trying to survive a broken home, poverty, fatherlessness, and a voice in his head that won't go away. With the wisdom of a drunken stranger King Lee, the unspoken love of his best friend Sea'Sea, and the innocent eyes of his two-year-old nephew Javion, Amel embarks on an unknown journey of truth, understanding, and forgiveness, hoping that his journey will lead him to experience his ultimate definition of freedom, a life worth living. ...more",2,Books,£31.58,£31.58,£0.00,In stock (6 available),0,https://books.toscrape.com/media/cache/2f/b6/2fb66b628ee51169b91cdfce8b68d929.jpg,https://books.toscrape.com/catalogue/the-makings-of-a-fatherless-child_450/index.html
