Название,Категория,UPC (Айди),Описание,Рейтинг,Тип продукта,Цена без налога,Цена с налогом:,Налог,Наличие,Кол-во отзывов,Картинка,Ссылка
The Joy of Cooking,Add a comment,d326e189b1210916,"Since its original publication, Joy of Cooking has been the most authoritative cookbook in America, the one upon which millions of cooks have confidently relied for more than sixty-five years. It's the book your grandmother and mother probably learned to cook from, the book you gave your sister when she got married. This, the first revision in more than twenty years, is be Since its original publication, Joy of Cooking has been the most authoritative cookbook in America, the one upon which millions of cooks have confidently relied for more than sixty-five years. It's the book your grandmother and mother probably learned to cook from, the book you gave your sister when she got married. This, the first revision in more than twenty years, is better than ever. Here's why: Every chapter has been rethought with an emphasis on freshness, convenience, and health.All the recipes have been reconceived and tested with an eye to modern taste, and the cooking knowledge imparted with each subject enriched to the point where everyone from a beginning to an experienced cook will feel completely supported.The new Joy continues the vision of American cooking that began with the first edition of Joy. It is still the book you can turn to for perfect Beef Wellington and Baked Macaroni and Cheese. It's also the book where you can now find Turkey on the Grill, Spicy Peanut Sesame Noodles, and vegetarian meals.The new Joy provides more thorough descriptions of ingredients, from the familiar to the most exotic. For instance, almost all the varieties of apples grown domestically are described-- the months they become available, how they taste, what they are best used for, and how long they keep. But for the first time Joy features a complete section on fresh and dried chili peppers: how to roast and grill them, how to store them, and how long they keep-- with illustrations of each pepper.An all-new ""RULES"" section in many chapters gives essential cooking basics at a glance: washing and storing salad greens, selecting a pasta and a matching sauce, determining when a piece of fish is cooked through, stuffing a chicken, and making a perfect souffle.New chapters reflect changing American tastes and lifestyles:Separate new chapters on grains, beans, and pasta include recipes for grits, polenta, pilafs, risottos, vegetarian chills, bean casseroles, and make-ahead lasagnes.New baking and dessert chapters promise to enhance Joy of Cooking's reputation as a bible for bakers. Quick and yeast bread recipes range from focaccia, pizza, and sourdoughs to muffins and coffee cakes. Separate chapters cover custards and puddings, pies and tarts, cookies, cakes, cobblers, and other American fruit desserts revived for this edition. Recipes include one-bowl cakes, gingerbread, angel and sponge cakes, meringues, pound cakes, fruitcakes, 6 different kinds of cheesecake-- there's even an illustrated wedding cake recipe, which takes you through all the stages from building a stand, making and decorating the cake, to transporting it to the reception without a hitch.Little Dishes showcases foods from around the world: hummus, baba ghanoush, bruschetta, tacos, empanadas, and fried wontons.AII new drawings of techniques, ingredients, and equipment, integrated throughout an elegant new design, and over 300 more pages round out the new Joy.Among this book's other unique features: microwave instructions for preparing beans, grains, and vegetables; dozens of new recipes for people who are lactose intolerant and allergic to gluten; expanded ingredients chart now features calories, essential vitamins, and levels of fats and cholesterol. There are ideas for substitutions to lower fat in recipes and reduced-fat recipes in the baking sections.From cover to cover, Joy's chapters have been imbued with the knowledge and passion of America's greatest cooks and cooking teachers. An invaluable combination of old and new, this edition of Joy of Cooking promises to keep you cooking for years to come. ...more",4,Books,£43.27,£43.27,£0.00,In stock (6 available),0,https://books.toscrape.com/media/cache/2c/81/2c8137d1d0a3ebb2f74d7abf45916606.jpg,https://books.toscrape.com/catalogue/the-joy-of-cooking_449/index.html
The Invention of Wings,Historical Fiction,e6635f5b0a2c78db,"Writing at the height of her narrative and imaginative gifts, Sue Monk Kidd presents a masterpiece of hope, daring, the quest for freedom, and the desire to have a voice in the world—and it is now the newest Oprah’s Book Club 2.0 selection.Hetty “Handful” Grimke, an urban slave in early nineteenth century Charleston, yearns for life beyond the suffocating walls that enclos Writing at the height of her narrative and imaginative gifts, Sue Monk Kidd presents a masterpiece of hope, daring, the quest for freedom, and the desire to have a voice in the world—and it is now the newest Oprah’s Book Club 2.0 selection.Hetty “Handful” Grimke, an urban slave in early nineteenth century Charleston, yearns for life beyond the suffocating walls that enclose her within the wealthy Grimke household. The Grimke’s daughter, Sarah, has known from an early age she is meant to do something large in the world, but she is hemmed in by the limits imposed on women.Kidd’s sweeping novel is set in motion on Sarah’s eleventh birthday, when she is given ownership of ten year old Handful, who is to be her handmaid. We follow their remarkable journeys over the next thirty five years, as both strive for a life of their own, dramatically shaping each other’s destinies and forming a complex relationship marked by guilt, defiance, estrangement and the uneasy ways of love.As the stories build to a riveting climax, Handful will endure loss and sorrow, finding courage and a sense of self in the process. Sarah will experience crushed hopes, betrayal, unrequited love, and ostracism before leaving Charleston to find her place alongside her fearless younger sister, Angelina, as one of the early pioneers in the abolition and women’s rights movements.Inspired by the historical figure of Sarah Grimke, Kidd goes beyond the record to flesh out the rich interior lives of all of her characters, both real and invented, including Handful’s cunning mother, Charlotte, who courts danger in her search for something better.This exquisitely written novel is a triumph of storytelling that looks with unswerving eyes at a devastating wound in American history, through women whose struggles for liberation, empowerment, and expression will leave no reader unmoved. ...more",1,Books,£37.34,£37.34,£0.00,In stock (6 available),0,https://books.toscrape.com/media/cache/7a/b0/7ab00e6956f540bfe0018656d5bfe1e4.jpg,https://books.toscrape.com/catalogue/the-invention-of-wings_448/index.html
The Hobbit (Middle-Earth Universe),Default,72b5355dda190b6a,"In a hole in the ground there lived a hobbit. Not a nasty, dirty, wet hole, filled with the ends of worms and an oozy smell, nor yet a dry, bare, sandy hole with nothing in it to sit down on or to eat: it was a hobbit-hole, and that means comfort.Written for J.R.R. Tolkien’s own children, The Hobbit met with instant critical acclaim when it was first published in 1937. Now In a hole in the ground there lived a hobbit. Not a nasty, dirty, wet hole, filled with the ends of worms and an oozy smell, nor yet a dry, bare, sandy hole with nothing in it to sit down on or to eat: it was a hobbit-hole, and that means comfort.Written for J.R.R. Tolkien’s own children, The Hobbit met with instant critical acclaim when it was first published in 1937. Now recognized as a timeless classic, this introduction to the hobbit Bilbo Baggins, the wizard Gandalf, Gollum, and the spectacular world of Middle-earth recounts of the adventures of a reluctant hero, a powerful and dangerous ring, and the cruel dragon Smaug the Magnificent. The text in this 372-page paperback edition is based on that first published in Great Britain by Collins Modern Classics (1998), and includes a note on the text by Douglas A. Anderson (2001). Unforgettable! ...more",5,Books,£17.80,£17.80,£0.00,In stock (6 available),0,https://books.toscrape.com/media/cache/17/06/1706d016ec39ba3caad03b49737fefc7.jpg,https://books.toscrape.com/catalogue/the-hobbit-middle-earth-universe_447/index.html
The Great Railway Bazaar,Travel,48736df57e7bec9f,"First published more than thirty years ago, Paul Theroux's strange, unique, and hugely entertaining railway odyssey has become a modern classic of travel literature. Here Theroux recounts his early adventures on an unusual grand continental tour. Asia's fabled trains -- the Orient Express, the Khyber Pass Local, the Frontier Mail, the Golden Arrow to Kuala Lumpur, the Mand First published more than thirty years ago, Paul Theroux's strange, unique, and hugely entertaining railway odyssey has become a modern classic of travel literature. Here Theroux recounts his early adventures on an unusual grand continental tour. Asia's fabled trains -- the Orient Express, the Khyber Pass Local, the Frontier Mail, the Golden Arrow to Kuala Lumpur, the Mandalay Express, the Trans-Siberian Express -- are the stars of a journey that takes him on a loop eastbound from London's Victoria Station to Tokyo Central, then back from Japan on the Trans-Siberian. Brimming with Theroux's signature humor and wry observations, this engrossing chronicle is essential reading for both the ardent adventurer and the armchair traveler. ...more",1,Books,£30.54,£30.54,£0.00,In stock (6 available),0,https://books.toscrape.com/media/cache/d5/82/d582f6b0261c2842330e893962276295.jpg,https://books.toscrape.com/catalogue/the-great-railway-bazaar_446/index.html
The Golden Compass (His Dark Materials #1),Add a comment,d33824cb93ecab6f,"Here lives an orphaned ward named Lyra Belacqua, whose carefree life among the scholars at Oxford's Jordan College is shattered by the arrival of two powerful visitors. First, her fearsome uncle, Lord Asriel, appears with evidence of mystery and danger in the far North, including photographs of a mysterious celestial phenomenon called Dust and the dim outline of a city sus Here lives an orphaned ward named Lyra Belacqua, whose carefree life among the scholars at Oxford's Jordan College is shattered by the arrival of two powerful visitors. First, her fearsome uncle, Lord Asriel, appears with evidence of mystery and danger in the far North, including photographs of a mysterious celestial phenomenon called Dust and the dim outline of a city suspended in the Aurora Borealis that he suspects is part of an alternate universe. He leaves Lyra in the care of Mrs. Coulter, an enigmatic scholar and explorer who offers to give Lyra the attention her uncle has long refused her. In this multilayered narrative, however, nothing is as it seems. Lyra sets out for the top of the world in search of her kidnapped playmate, Roger, bearing a rare truth-telling instrument, the alethiometer. All around her children are disappearing—victims of so-called ""Gobblers""—and being used as subjects in terrible experiments that separate humans from their daemons, creatures that reflect each person's inner being. And somehow, both Lord Asriel and Mrs. Coulter are involved. ...more",1,Books,£18.77,£18.77,£0.00,In stock (6 available),0,https://books.toscrape.com/media/cache/a5/13/a513b65a8f7696c8aec48a607f7f90d3.jpg,https://books.toscrape.com/catalogue/the-golden-compass-his-dark-materials-1_445/index.html
The God Delusion,Add a comment,2bc80eba94950873,"A preeminent scientist -- and the world's most prominent atheist -- asserts the irrationality of belief in God and the grievous harm religion has inflicted on society, from the Crusades to 9/11.With rigor and wit, Dawkins examines God in all his forms, from the sex-obsessed tyrant of the Old Testament to the more benign (but still illogical) Celestial Watchmaker favored by A preeminent scientist -- and the world's most prominent atheist -- asserts the irrationality of belief in God and the grievous harm religion has inflicted on society, from the Crusades to 9/11.With rigor and wit, Dawkins examines God in all his forms, from the sex-obsessed tyrant of the Old Testament to the more benign (but still illogical) Celestial Watchmaker favored by some Enlightenment thinkers. He eviscerates the major arguments for religion and demonstrates the supreme improbability of a supreme being. He shows how religion fuels war, foments bigotry, and abuses children, buttressing his points with historical and contemporary evidence. The God Delusion makes a compelling case that belief in God is not just wrong but potentially deadly. It also offers exhilarating insight into the advantages of atheism to the individual and society, not the least of which is a clearer, truer appreciation of the universe's wonders than any faith could ever muster. ...more",3,Books,£46.85,£46.85,£0.00,In stock (6 available),0,https://books.toscrape.com/media/cache/30/35/3035b6c5dc0a48a83fbe84eb37e76f10.jpg,https://books.toscrape.com/catalogue/the-god-delusion_444/index.html
The Girl You Left Behind (The Girl You Left Behind #1),Historical,eb7459e0c570251d,"What happened to the girl you left behind?In 1916, French artist Edouard Lefevre leaves his wife Sophie to fight at the Front. When her town falls into German hands, his portrait of Sophie stirs the heart of the local Kommandant and causes her to risk everything - her family, reputation and life—in the hope of seeing her true love one last time.Nearly a century later and S What happened to the girl you left behind?In 1916, French artist Edouard Lefevre leaves his wife Sophie to fight at the Front. When her town falls into German hands, his portrait of Sophie stirs the heart of the local Kommandant and causes her to risk everything - her family, reputation and life—in the hope of seeing her true love one last time.Nearly a century later and Sophie's portrait is given to Liv by her young husband shortly before his sudden death. Its beauty speaks of their short life together, but when the painting's dark and passion-torn history is revealed, Liv discovers that the first spark of love she has felt since she lost him is threatened...In The Girl You Left Behind two young women, separated by a century, are united in their determination to fight for the thing they love most—whatever the cost. ...more",1,Books,£15.79,£15.79,£0.00,In stock (6 available),0,https://books.toscrape.com/media/cache/6d/72/6d72120f94d38e356612c8a78e82a53d.jpg,https://books.toscrape.com/catalogue/the-girl-you-left-behind-the-girl-you-left-behind-1_443/index.html
The Fellowship of the Ring (The Lord of the Rings #1),Default,cb17945cb90b7837,Frodo Baggins knew the Ringwraiths were searching for him—and the Ring of Power he bore that would enable Sauron to destroy all that was good in Middle-earth. Now it was up to Frodo and his faithful servant Sam to carry the Ring to where it could be destroyed—in the very center of Sauron's dark kingdom.,2,Books,£10.27,£10.27,£0.00,In stock (6 available),0,https://books.toscrape.com/media/cache/5d/9f/5d9f339be8d98f597ad33eee239119d8.jpg,https://books.toscrape.com/catalogue/the-fellowship-of-the-ring-the-lord-of-the-rings-1_442/index.html
The Collected Poems of W.B. Yeats (The Collected Works of W.B. Yeats #1),Poetry,3d250ab0f12be445,"The Collected Poems of W. B. Yeats includes all of the poems authorized by Yeats for inclusion in his standard canon. Breathtaking in range, it encompasses the entire arc of his career, from luminous reworking of ancient Irish myths and legends to passionate meditations on the demands and rewards of youth and old age, from exquisite, occasionally whimsical songs of love, n The Collected Poems of W. B. Yeats includes all of the poems authorized by Yeats for inclusion in his standard canon. Breathtaking in range, it encompasses the entire arc of his career, from luminous reworking of ancient Irish myths and legends to passionate meditations on the demands and rewards of youth and old age, from exquisite, occasionally whimsical songs of love, nature, and art to somber and angry poems of life in a nation torn by war and uprising. In observing the development of rich and recurring images and themes over the course of his body of work, we can trace the quest of this century's greatest poet to unite intellect and artistry in a single magnificent vision.Revised and corrected, this edition includes Yeat's own notes on his poetry, complemented by explanatory notes from esteemed Yeats scholar Richard J. Finneran. The Collected Poems of W. B. Yeats is the most comprehensive edition of one of the world's most beloved poets available in paperback. ...more",5,Books,£15.42,£15.42,£0.00,In stock (6 available),0,https://books.toscrape.com/media/cache/b3/8c/b38cadc69f4a2db0aae2ee2867ab8583.jpg,https://books.toscrape.com/catalogue/the-collected-poems-of-wb-yeats-the-collected-works-of-wb-yeats-1_441/index.html
