Название,Категория,UPC (Айди),Описание,Рейтинг,Тип продукта,Цена без налога,Цена с налогом:,Налог,Наличие,Кол-во отзывов,Картинка,Ссылка
John Vassos: Industrial Design for Modern Life,Default,bd26e8a79a856c31,"What should a television look like? How should a dial on a radio feel to the touch? These were questions John Vassos asked when the Radio Corporation of America (RCA) asked him to design the first mass-produced television receiver, the TRK-12, which had its spectacular premier at the 1939 New York World’s Fair. Vassos emigrated from Greece and arrived in the United States What should a television look like? How should a dial on a radio feel to the touch? These were questions John Vassos asked when the Radio Corporation of America (RCA) asked him to design the first mass-produced television receiver, the TRK-12, which had its spectacular premier at the 1939 New York World’s Fair. Vassos emigrated from Greece and arrived in the United States in 1918. His career spans the evolution of central forms of mass media in the twentieth century and offers a template for understanding their success. This is Vassos’s legacy—shaping the way we interact with our media technologies. Other industrial designers may be more celebrated, but none were more focused on making radio and television attractive and accessible to millions of Americans.In John Vassos: Industrial Design for Modern Life, Danielle Shapiro is the first to examine the life and work of RCA’s key consultant designer through the rise of radio and television and into the computer era. Vassos conceived a vision for the look of new technologies still with us today. A founder of the Industrial Designers Society of America, he was instrumental in the development of a self-conscious industrial design profession during the late 1920s and 1930s and into the postwar period. Drawing on unpublished records and correspondence, Shapiro creates a portrait of a designer whose early artistic work in books like Phobia and Contempo critiqued the commercialization of modern life but whose later design work sought to accommodate it.Replete with rich behind-the-product stories of America’s design culture in the 1930s through the 1950s, this volume also chronicles the emergence of what was to become the nation’s largest media company and provides a fascinating glimpse into its early corporate culture. In our current era of watching TV on an iPod or a smartphone, Shapiro stimulates broad discussions of the meaning of technological design for mass media in daily life. ...more",4,Books,£20.22,£20.22,£0.00,In stock (8 available),0,https://books.toscrape.com/media/cache/e8/d4/e8d47e80b92650728b837930cc578d63.jpg,https://books.toscrape.com/catalogue/john-vassos-industrial-design-for-modern-life_526/index.html
I'll Give You the Sun,Default,0ab4b35dcffcffd1,"A brilliant, luminous story of first love, family, loss, and betrayal for fans of John Green, David Levithan, and Rainbow Rowell Jude and her twin brother, Noah, are incredibly close. At thirteen, isolated Noah draws constantly and is falling in love with the charismatic boy next door, while daredevil Jude cliff-dives and wears red-red lipstick and does the talking for bo A brilliant, luminous story of first love, family, loss, and betrayal for fans of John Green, David Levithan, and Rainbow Rowell Jude and her twin brother, Noah, are incredibly close. At thirteen, isolated Noah draws constantly and is falling in love with the charismatic boy next door, while daredevil Jude cliff-dives and wears red-red lipstick and does the talking for both of them. But three years later, Jude and Noah are barely speaking. Something has happened to wreck the twins in different and dramatic ways . . . until Jude meets a cocky, broken, beautiful boy, as well as someone else—an even more unpredictable new force in her life. The early years are Noah's story to tell. The later years are Jude's. What the twins don't realize is that they each have only half the story, and if they could just find their way back to one another, they’d have a chance to remake their world. This radiant novel from the acclaimed, award-winning author of The Sky Is Everywhere will leave you breathless and teary and laughing—often all at once. ...more",1,Books,£56.48,£56.48,£0.00,In stock (8 available),0,https://books.toscrape.com/media/cache/57/a8/57a87a9b1ed0de0e6d1c048f575f327f.jpg,https://books.toscrape.com/catalogue/ill-give-you-the-sun_525/index.html
I Will Find You,Nonfiction,bbf1ea50be8008ab,"“This is it. My rape. I knew it was coming. Every woman knows. And now here it is. My turn.” When Joanna Connors was thirty years old on assignment for the Cleveland Plain Dealer to review a play at a college theater, she was held at knife point and raped by a stranger who had grown up five miles away from her. Once her assailant was caught and sentenced, Joanna never spo “This is it. My rape. I knew it was coming. Every woman knows. And now here it is. My turn.” When Joanna Connors was thirty years old on assignment for the Cleveland Plain Dealer to review a play at a college theater, she was held at knife point and raped by a stranger who had grown up five miles away from her. Once her assailant was caught and sentenced, Joanna never spoke of the trauma again, until 21 years later when her daughter was about to go to college. She resolved then to tell her children about her own rape so they could learn and protect themselves, and she began to realize that the man who assaulted her was one of the formative people in her life.Setting out to uncover the story of her attacker, Connors embarked on a journey to find out who he was, where he came from, who his friends were and what his life was like. What she discovers stretches beyond one violent man’s story and back into her own, interweaving a narrative about strength and survival with one about rape culture and violence in America.I Will Find You is a brave, timely consideration of race, class, education and the families that shape who we become, by a reporter and a survivor. ...more",1,Books,£44.21,£44.21,£0.00,In stock (8 available),0,https://books.toscrape.com/media/cache/58/08/58080dbe2c118867331f4ef932ca96c0.jpg,https://books.toscrape.com/catalogue/i-will-find-you_524/index.html
Hystopia: A Novel,Fiction,0bfdef63285d3019,"By the early 1970s, President John F. Kennedy has survived several assassination attempts and--martyred, heroic--is now in his third term. Twenty-two-year-old Eugene Allen returns home from his tour of duty in Vietnam and begins to write a war novel--a book echoing Catch-22 and Slaughterhouse-Five--about veterans who have their battlefield experiences ""enfolded,"" wiped fro By the early 1970s, President John F. Kennedy has survived several assassination attempts and--martyred, heroic--is now in his third term. Twenty-two-year-old Eugene Allen returns home from his tour of duty in Vietnam and begins to write a war novel--a book echoing Catch-22 and Slaughterhouse-Five--about veterans who have their battlefield experiences ""enfolded,"" wiped from their memories through drugs and therapy. In Eugene's fictive universe, veterans too damaged to be enfolded stalk the American heartland, reenacting atrocities on civilians and evading the Psych Corps, a federal agency dedicated to upholding the mental hygiene of the nation by any means necessary.This alternative America, in which a veteran tries to reimagine a damaged world, is the subject of Hystopia, the long-awaited first novel by David Means. The critic James Wood has written that Means's language ""offers an exquisitely precise and sensuous register of an often crazy American reality."" Means brings this talent to bear on the national trauma of the Vietnam era in a work that is outlandish, ruefully funny, and shockingly violent. Written in conversation with some of the greatest war narratives from the Iliad to the Rolling Stones' ""Gimme Shelter,"" Hystopia is a unique and visionary novel. ...more",4,Books,£21.96,£21.96,£0.00,In stock (8 available),0,https://books.toscrape.com/media/cache/23/2f/232fdac6b00cd3c7cd2b2336ff3b730e.jpg,https://books.toscrape.com/catalogue/hystopia-a-novel_523/index.html
Howl and Other Poems,Poetry,b7870fa6dc088fbb,"The prophetic poem that launched a generation when it was first published in 1965 is here presented in a commemorative fortieth Anniversary Edition.When the book arrived from its British printers, it was seized almost immediately by U.S. Customs, and shortly thereafter the San Francisco police arrested its publisher and editor, Lawrence Ferlinghetti, together with City Lig The prophetic poem that launched a generation when it was first published in 1965 is here presented in a commemorative fortieth Anniversary Edition.When the book arrived from its British printers, it was seized almost immediately by U.S. Customs, and shortly thereafter the San Francisco police arrested its publisher and editor, Lawrence Ferlinghetti, together with City Lights Bookstore manager Shigeyoshi Murao. The two of them were charged with disseminating obscene literature, and the case went to trial in the municipal court of Judge Clayton Horn. A parade of distinguished literary and academic witnesses persuaded the judge that the title poem was indeed not obscene and that it had “redeeming social significance.”Thus was Howl & Other Poems freed to become the single most influential poetic work of the post-World War II era, with over 900,000 copies now in print."" ...more",2,Books,£40.45,£40.45,£0.00,In stock (8 available),0,https://books.toscrape.com/media/cache/09/8e/098e81fcea9f6b4c15f6d207301c0085.jpg,https://books.toscrape.com/catalogue/howl-and-other-poems_522/index.html
History of Beauty,Art,8a150fd8ff5d7686,"Now in paperback, Umberto Eco’s groundbreaking and much-acclaimed first illustrated book has been a critical success since its first publication in 2004. What is beauty? Umberto Eco, among Italy’s finest and most important contemporary thinkers, explores the nature, the meaning, and the very history of the idea of beauty in Western culture. The profound and subtle text is Now in paperback, Umberto Eco’s groundbreaking and much-acclaimed first illustrated book has been a critical success since its first publication in 2004. What is beauty? Umberto Eco, among Italy’s finest and most important contemporary thinkers, explores the nature, the meaning, and the very history of the idea of beauty in Western culture. The profound and subtle text is lavishly illustrated with abundant examples of sublime painting and sculpture and lengthy quotations from writers and philosophers. This is the first paperback edition of History of Beauty, making this intellectual and philosophical journey with one of the world’s most acclaimed thinkers available in a more compact and affordable format.From the Trade Paperback edition ...more",4,Books,£10.29,£10.29,£0.00,In stock (8 available),0,https://books.toscrape.com/media/cache/cb/74/cb74d2953d5249143c3c2e3c281daf6f.jpg,https://books.toscrape.com/catalogue/history-of-beauty_521/index.html
