Название,Категория,UPC (Айди),Описание,Рейтинг,Тип продукта,Цена без налога,Цена с налогом:,Налог,Наличие,Кол-во отзывов,Картинка,Ссылка
The Nanny Diaries (Nanny #1),Womens Fiction,6263c1d2997b8ce0,"Wanted: One young woman to take care of four-year-old boy. Must be cheerful, enthusiastic and selfless--bordering on masochistic. Must relish sixteen-hour shifts with a deliberately nap-deprived preschooler. Must love getting thrown up on, literally and figuratively, by everyone in his family. Must enjoy the delicious anticipation of ridiculously erratic pay. Mostly, must Wanted: One young woman to take care of four-year-old boy. Must be cheerful, enthusiastic and selfless--bordering on masochistic. Must relish sixteen-hour shifts with a deliberately nap-deprived preschooler. Must love getting thrown up on, literally and figuratively, by everyone in his family. Must enjoy the delicious anticipation of ridiculously erratic pay. Mostly, must love being treated like fungus found growing out of employers Hermès bag. Those who take it personally need not apply.Who wouldn't want this job? Struggling to graduate from NYU and afford her microscopic studio apartment, Nanny takes a position caring for the only son of the wealthy X family. She rapidly learns the insane amount of juggling involved to ensure that a Park Avenue wife who doesn't work, cook, clean, or raise her own child has a smooth day.When the Xs' marriage begins to disintegrate, Nanny ends up involved way beyond the bounds of human decency or good taste. Her tenure with the X family becomes a nearly impossible mission to maintain the mental health of their four-year-old, her own integrity and, most importantly, her sense of humor. Over nine tense months, Mrs. X and Nanny perform the age-old dance of decorum and power as they test the limits of modern-day servitude.Written by two former nannies, The Nanny Diaries deftly punctures the glamour of Manhattan's upper class. ...more",5,Books,£52.53,£52.53,£0.00,In stock (3 available),0,https://books.toscrape.com/media/cache/e3/4e/e34e69942bf1327c602ef9754d02a022.jpg,https://books.toscrape.com/catalogue/the-nanny-diaries-nanny-1_265/index.html
The Name of God is Mercy,Nonfiction,0baf71623648413a,"NEW YORK TIMES BESTSELLER •In his first book published as Pope, and in conjunction with the Extraordinary Jubilee of Mercy, Pope Francis here invites all humanity to an intimate and personal dialogue on the subject closest to his heart—mercy—which has long been the cornerstone of his faith and is now the central teaching of his papacy. In this conversation with Vatican r NEW YORK TIMES BESTSELLER • In his first book published as Pope, and in conjunction with the Extraordinary Jubilee of Mercy, Pope Francis here invites all humanity to an intimate and personal dialogue on the subject closest to his heart—mercy—which has long been the cornerstone of his faith and is now the central teaching of his papacy. In this conversation with Vatican reporter Andrea Tornielli, Francis explains—through memories from his youth and moving anecdotes from his experiences as a pastor—why “mercy is the first attribute of God.” God “does not want anyone to be lost. His mercy is infinitely greater than our sins,” he writes. As well, the Church cannot close the door on anyone, Francis asserts—on the contrary, its duty is to go out into the world to find its way into the consciousness of people so that they can assume responsibility for, and move away from, the bad things they have done. The first Jesuit and the first South American to be elected Bishop of Rome, Pope Francis has traveled around the world spreading God’s message of mercy to the largest crowds in papal history. Clear and profound, The Name of God Is Mercy resonates with this desire to reach all those who are looking for meaning in life, a road to peace and reconciliation, and the healing of physical and spiritual wounds. It is being published in more than eighty countries around the world.“The name of God is mercy. There are no situations we cannot get out of, we are not condemned to sink into quicksand.”—Pope FrancisPraise for The Name of God Is Mercy “Francis speaks succinctly—and with refreshing forthrightness. . . . He emphasizes moral sincerity over dogma, an understanding of the complexities of the world and individual experience over rigid doctrine. . . . The pope has an easy conversational style that moves effortlessly between folksy sayings and erudite allusions, between common-sense logic and impassioned philosophical insights.”—Michiko Kakutani, The New York Times“What makes his book most moving is the way in which this man, without disrespecting his own privacy or offering false bromides of modesty, opens the sacred space of his conscience to explain how he came to center his ministry, and now his papacy, around mercy.”—James Carroll, The New Yorker“As he has done throughout his papacy, Pope Francis shows in this book a compelling way to present God’s love anew to a skeptical world without denying the ancient teachings of faith. But now he is challenging the entire Church to trek a new way forward.”—Time “Francis enjoys sharing personal stories of God’s grace and mercy in the lives of parishioners from his native Argentina, people he has known and who have recognized themselves as sinners.”—The Washington Post“Powerful . . . Francis’s book signals a plea for a change of attitude on the part of the faithful and their pastors. . . . Bishops and priests will talk and quarrel over the text for months, even years to come. And that, perhaps, is what Francis intends.”—Financial Times “Deepens his calls for a more merciful Catholic Church . . . The question-and-answer book is told in simple, breezy language, with the pope referring to experiences and people in his own life.”—Newsday “Francis has offered his most detailed outline yet for the role of the Catholic church in the modern era.”—National Catholic ReporterTranslated by Oonagh Stransky From the Hardcover edition. ...more",2,Books,£37.25,£37.25,£0.00,In stock (3 available),0,https://books.toscrape.com/media/cache/01/7c/017c9fd993b4ebb5676213f6de1f96c5.jpg,https://books.toscrape.com/catalogue/the-name-of-god-is-mercy_264/index.html
The Maze Runner (The Maze Runner #1),Default,4266f48a0aa1c37d,"If you ain’t scared, you ain’t human.When Thomas wakes up in the lift, the only thing he can remember is his name. He’s surrounded by strangers—boys whose memories are also gone.Nice to meet ya, shank. Welcome to the Glade.Outside the towering stone walls that surround the Glade is a limitless, ever-changing maze. It’s the only way out—and no one’s ever made it through ali If you ain’t scared, you ain’t human.When Thomas wakes up in the lift, the only thing he can remember is his name. He’s surrounded by strangers—boys whose memories are also gone.Nice to meet ya, shank. Welcome to the Glade.Outside the towering stone walls that surround the Glade is a limitless, ever-changing maze. It’s the only way out—and no one’s ever made it through alive.Everything is going to change.Then a girl arrives. The first girl ever. And the message she delivers is terrifying.Remember. Survive. Run. ...more",1,Books,£20.93,£20.93,£0.00,In stock (3 available),0,https://books.toscrape.com/media/cache/e1/56/e156706ae507fdd59aa933675a480d07.jpg,https://books.toscrape.com/catalogue/the-maze-runner-the-maze-runner-1_263/index.html
The Lover's Dictionary,Default,36c15687f5ab0f7c,"basis, n.There has to be a moment at the beginning when you wonder whether you're in love with the person or in love with the feeling of love itself.If the moment doesn't pass, that's it―you're done. And if the moment does pass, it never goes that far. It stands in the distance, ready for whenever you want it back. Sometimes it's even there when you thought you were search basis, n.There has to be a moment at the beginning when you wonder whether you're in love with the person or in love with the feeling of love itself.If the moment doesn't pass, that's it―you're done. And if the moment does pass, it never goes that far. It stands in the distance, ready for whenever you want it back. Sometimes it's even there when you thought you were searching for something else, like an escape route, or your lover's face.How does one talk about love? Do we even have the right words to describe something that can be both utterly mundane and completely transcendent, pulling us out of our everyday lives and making us feel a part of something greater than ourselves? Taking a unique approach to this problem, the nameless narrator of David Levithan's The Lover's Dictionary has constructed the story of his relationship as a dictionary. Through these short entries, he provides an intimate window into the great events and quotidian trifles of being within a couple, giving us an indelible and deeply moving portrait of love in our time. ...more",2,Books,£58.09,£58.09,£0.00,In stock (3 available),0,https://books.toscrape.com/media/cache/0b/e9/0be9284a6b11e3517504aa9a44f87a3a.jpg,https://books.toscrape.com/catalogue/the-lovers-dictionary_262/index.html
The Lonely Ones,Childrens,cf2f27fdf94ba20e,"When your only friend is your own endless imagination, how do you escape your mind and connect to the world around you?With parents too busy to pay her attention, an older brother and sister who would rather spend their time with friends, and peers who oscillate between picking on her and simply ignoring her, it's no wonder that Fain spends most of her time in a world of h When your only friend is your own endless imagination, how do you escape your mind and connect to the world around you? With parents too busy to pay her attention, an older brother and sister who would rather spend their time with friends, and peers who oscillate between picking on her and simply ignoring her, it's no wonder that Fain spends most of her time in a world of her own making. During the day, Fain takes solace in crafting her own fantastical adventures in writing, but in the darkness of night, these adventures come to life as Fain lives and breathes alongside a legion of imaginary creatures. Whether floating through space or under the sea, climbing mountains or traipsing through forests, Fain becomes queen beyond - and in spite of - the walls of her bedroom.In time, Fain begins to see possibilities and friendships emerge in her day-to-day reality. . . yet when she is let down by the one relationship she thought she could trust, Fain must decide: remain queen of the imaginary creatures, or risk the pain that comes with opening herself up to the fragile connections that exist only in the real world? Told in breathless and visual verse, THE LONELY ONES takes readers through the intricate inner workings of a girl who struggles to navigate isolation and finds friendship where she least expects it. ...more",5,Books,£43.59,£43.59,£0.00,In stock (3 available),0,https://books.toscrape.com/media/cache/ff/f6/fff64acb3c65cbea2ac9209c2a57af17.jpg,https://books.toscrape.com/catalogue/the-lonely-ones_261/index.html
